{
  "schema_version": "0.2",
  "run_id": "YYYYMMDD-HHMMSS-project-purpose",
  "project_id": "example-project",
  "project_root": ".",
  "repo_root": ".",
  "remote_url": "",
  "branch": "",
  "start_commit": "",
  "end_commit": "",
  "run_state": "SIGNABLE",
  "started_at": "",
  "ended_at": "",
  "summary": "",
  "scope": "",
  "validation_state": "pass",
  "readme_state": "audited_no_change",
  "variable_matrix_state": "no_change_verified",
  "handoff_state": "updated",
  "boh_sync_state": "queued",
  "git_state": "clean",
  "risk_level": "low",
  "next_action": "",
  "ledger_path": ".project/runs/YYYYMMDD-HHMMSS-project-purpose.md",
  "atlas_packet_path": ".project/atlas_outbox/YYYYMMDD-HHMMSS-project-purpose.json",
  "boh_packet_path": ".project/boh_outbox/YYYYMMDD-HHMMSS-project-purpose.json",
  "profiles": ["private_repo"],
  "overrides": []
}

