{
  "schema_version": "0.2",
  "run_id": "20260709_coheronia_fq09v_visual_variants",
  "project_id": "coheronia-game",
  "project_root": "B:/dev/Coheronia/coheronia_fable_oneshot_repo",
  "repo_root": "B:/dev/Coheronia/coheronia_fable_oneshot_repo",
  "branch": "main",
  "start_commit": "447a725",
  "end_commit": "516bc13",
  "run_state": "SIGNABLE",
  "started_at": "2026-07-09T16:20:00-04:00",
  "ended_at": "2026-07-09T17:00:00-04:00",
  "summary": "FQ-09V visual variant pipeline: one visual id may now ship several optional variant images — the consecutive-file convention <id>_01.png..<id>_08.png (first gap ends the scan) or explicit array entries in data/visual_assets.json (validator: every path must exist, empty pools fail). BlockRegistry.visual_variant_textures resolves the pool (cached, cleared with the visual cache); world builds one tileset atlas source per variant with identical physics/occlusion, and _set_tile picks posmod(hash(Vector3i(cell.x, cell.y, world_seed)), n) — deterministic per seed+cell, never in saves. Single-image and no-image fallback paths byte-compatible; an explicit array's first entry doubles as the id's canonical single image so HUD/enemy consumers stay coherent. world.rebuild_tileset() smoke/dev hook. 5 self-cleaning fq09v_* checks (suite 185 -> 190); review SIGNABLE, should-fix guard + 2 clarity nits applied, loop re-ran green.",
  "scope": "FQ-09V only, per docs/FABLE_TASK_QUEUE.md — no new blocks, ores, stations, crops, enemies, or balance changes; the repo still ships zero art. Implementation commit 516bc13 plus this evidence-only packet commit; not pushed (operator-gated).",
  "validation_state": "pass",
  "readme_state": "updated",
  "variable_matrix_state": "updated",
  "handoff_state": "updated",
  "boh_sync_state": "queued",
  "git_state": "committed",
  "risk_level": "low",
  "next_action": "FQ-09A: future asset manifest and prompt packs.",
  "ledger_path": ".project/runs/20260709_coheronia_fq09v_visual_variants.md",
  "atlas_packet_path": ".project/atlas_outbox/20260709_coheronia_fq09v_visual_variants.json",
  "boh_packet_path": ".project/boh_outbox/20260709_coheronia_fq09v_visual_variants.json",
  "profiles": ["public_repo", "software_project"],
  "overrides": []
}
