{
  "schema_version": "0.2",
  "run_id": "20260702_coheronia_scaffold_setup",
  "project_id": "coheronia-game",
  "project_root": ".",
  "repo_root": ".",
  "remote_url": "",
  "branch": "not_repo_yet",
  "start_commit": "not_repo_yet",
  "end_commit": "not_repo_yet",
  "run_state": "SIGNABLE",
  "started_at": "2026-07-02T00:00:00-04:00",
  "ended_at": "2026-07-02T00:00:00-04:00",
  "summary": "Created governed Coheronia one-shot scaffold with feature outline, MVP contract, variable matrix, capsule surface, and Claude Code prompt.",
  "scope": "scaffold setup only; playable game not implemented",
  "validation_state": "partial",
  "readme_state": "updated",
  "variable_matrix_state": "updated",
  "handoff_state": "updated",
  "boh_sync_state": "queued",
  "git_state": "not_repo",
  "risk_level": "medium",
  "next_action": "Run Claude Code/Fable one-shot using PROMPT_FOR_CLAUDE_CODE.md.",
  "ledger_path": ".project/runs/20260702_coheronia_scaffold_setup.md",
  "atlas_packet_path": ".project/atlas_outbox/20260702_coheronia_scaffold_setup.json",
  "boh_packet_path": ".project/boh_outbox/20260702_coheronia_scaffold_setup.json",
  "profiles": [
    "private_repo",
    "software_project"
  ],
  "overrides": []
}
