{
  "schema_version": "0.2",
  "run_id": "20260709_coheronia_fq08r_crack_sprite_mask",
  "project_id": "coheronia-game",
  "project_root": "B:/dev/Coheronia/coheronia_fable_oneshot_repo",
  "repo_root": "B:/dev/Coheronia/coheronia_fable_oneshot_repo",
  "branch": "main",
  "start_commit": "4f35365",
  "end_commit": "e5cf23c",
  "run_state": "SIGNABLE",
  "started_at": "2026-07-09T14:20:00-04:00",
  "ended_at": "2026-07-09T15:15:00-04:00",
  "summary": "Operator-requested hardening: degradation visuals must stay inside the visible sprite. New world.block_opaque_mask(block_id) returns a cached BitMap of a tile texture's opaque pixels (art or generated fallback; null for air/unknown). The FQ-08 mining crack overlay keeps its per-cell deterministic seed/RNG sequence but rasterizes each crack segment pixel by pixel through the mask, so thin tree trunks, leaves, bushes, and torches only crack where their pixels exist; solid tiles are unaffected. Town Hall damage overlay and enemy hurt visuals audited — already sprite-bounded, no change. New smoke check fq08_crack_mask_inside_sprite; suite 183 -> 184, all green.",
  "scope": "Single hardening item on operator request (follow-up to FQ-08 damage visuals and FQ-09R unified trees). Implementation commit e5cf23c plus this evidence-only commit; pushed to origin/main on explicit request.",
  "validation_state": "pass",
  "readme_state": "updated",
  "variable_matrix_state": "updated",
  "handoff_state": "updated",
  "boh_sync_state": "queued",
  "git_state": "committed",
  "risk_level": "low",
  "next_action": "FQ-09S: skill tree visual treatment pass.",
  "ledger_path": ".project/runs/20260709_coheronia_fq08r_crack_sprite_mask.md",
  "atlas_packet_path": ".project/atlas_outbox/20260709_coheronia_fq08r_crack_sprite_mask.json",
  "boh_packet_path": ".project/boh_outbox/20260709_coheronia_fq08r_crack_sprite_mask.json",
  "profiles": ["public_repo", "software_project"],
  "overrides": []
}
