{
  "schema_version": "0.2",
  "run_id": "20260702_coheronia_v02_increment",
  "project_id": "coheronia-game",
  "project_root": "B:/dev/Coheronia/coheronia_fable_oneshot_repo",
  "repo_root": "B:/dev/Coheronia/coheronia_fable_oneshot_repo",
  "branch": "main",
  "start_commit": "4507936",
  "end_commit": "pending-closeout-commit-see-git-log",
  "run_state": "SIGNABLE",
  "started_at": "2026-07-02T12:05:00-04:00",
  "ended_at": "2026-07-02T12:40:00-04:00",
  "summary": "Operator-authorized v0.2 increment on the signed v0.1 slice: tool-tier progression (ore gated to tier 2, pick forged at the Town Hall from stockpile, tiers scale mining speed), food loop (berry bushes drop food, settlers eat 2/dawn, shortage feeds scarcity), per-tile light occlusion (blocks_light simulated via TileSet occluders + shadowed torch lights), and threat persistence in saves (v0.2 saves, v0.1 accepted). Smoke suite extended to 34 checks, all passing headless and windowed with reviewed screenshot.",
  "scope": "v0.2 features drawn from GAME_FEATURE_OUTLINE and documented v0.1 limitations; 'must not build yet' list untouched.",
  "validation_state": "pass",
  "readme_state": "updated",
  "variable_matrix_state": "updated",
  "handoff_state": "updated",
  "boh_sync_state": "queued",
  "git_state": "committed",
  "risk_level": "low",
  "next_action": "Operator playthrough of v0.2, then choose v0.3 scope from HANDOFF candidates.",
  "ledger_path": ".project/runs/20260702_coheronia_v02_increment.md",
  "atlas_packet_path": ".project/atlas_outbox/20260702_coheronia_v02_increment.json",
  "boh_packet_path": ".project/boh_outbox/20260702_coheronia_v02_increment.json",
  "profiles": ["private_repo", "software_project"],
  "overrides": []
}
