{
  "schema_version": "0.2",
  "run_id": "20260702_coheronia_v03_increment",
  "project_id": "coheronia-game",
  "project_root": "B:/dev/Coheronia/coheronia_fable_oneshot_repo",
  "repo_root": "B:/dev/Coheronia/coheronia_fable_oneshot_repo",
  "branch": "main",
  "start_commit": "1f498be",
  "end_commit": "pending-closeout-commit-see-git-log",
  "run_state": "SIGNABLE",
  "started_at": "2026-07-02T12:50:00-04:00",
  "ended_at": "2026-07-02T13:40:00-04:00",
  "summary": "v0.3 increment with a verification/optimization loop: berry regrowth (90s, persisted), dynamic population 1-8 (dawn food + coherence gates, population-scaled food need), daytime storm event mitigated by roof coverage over the hall, lanterns as the ore sink (Town Hall crafting, hotbar 5), and UX polish (cursor mining progress, live threat warning, save hint). Loop: smoke suite caught a design flaw (storm exposure keyed on shelter_score which ground fill saturates -> rekeyed to roof_coverage); an independent subagent diff review returned 9 findings (HUD overflow, stale threat count, storm re-roll on old saves, save version bump, roof scan cap, 4 smoke coverage gaps), all applied; final suite 47/47 headless and windowed with reviewed screenshot.",
  "scope": "The five v0.3 features recommended in the prior handoff; 'must not build yet' list untouched.",
  "validation_state": "pass",
  "readme_state": "updated",
  "variable_matrix_state": "updated",
  "handoff_state": "updated",
  "boh_sync_state": "queued",
  "git_state": "committed",
  "risk_level": "low",
  "next_action": "Operator playthrough (storm with/without roof, grow to 8 settlers), then v0.4 scoping.",
  "ledger_path": ".project/runs/20260702_coheronia_v03_increment.md",
  "atlas_packet_path": ".project/atlas_outbox/20260702_coheronia_v03_increment.json",
  "boh_packet_path": ".project/boh_outbox/20260702_coheronia_v03_increment.json",
  "profiles": ["private_repo", "software_project"],
  "overrides": []
}
