{
  "schema_version": "0.2",
  "run_id": "20260702_coheronia_input_repair",
  "project_id": "coheronia-game",
  "project_root": "B:/dev/Coheronia/coheronia_fable_oneshot_repo",
  "repo_root": "B:/dev/Coheronia/coheronia_fable_oneshot_repo",
  "branch": "main",
  "start_commit": "a6654b1",
  "end_commit": "pending-closeout-commit-see-git-log",
  "run_state": "SIGNABLE",
  "started_at": "2026-07-02T11:45:00-04:00",
  "ended_at": "2026-07-02T12:00:00-04:00",
  "summary": "Fixed dead keyboard/mouse input reported by operator: the scaffold's project.godot stored input events as JSON-style dictionaries, which Godot 4 silently discards, leaving every action with zero device bindings. Rewrote the [input] section with proper Object(InputEventKey/InputEventMouseButton) serialization and added a smoke check (input_actions_bound) asserting real device events exist, since programmatic Input.action_press() bypasses the InputMap. Smoke now 23/23.",
  "scope": "project.godot [input] rewrite, smoke_test.gd binding check, HANDOFF update. No gameplay changes.",
  "validation_state": "pass",
  "readme_state": "audited_no_change",
  "variable_matrix_state": "no_change_verified",
  "handoff_state": "updated",
  "boh_sync_state": "queued",
  "git_state": "committed",
  "risk_level": "low",
  "next_action": "Operator relaunch and playthrough; input should now respond.",
  "ledger_path": ".project/runs/20260702_coheronia_input_repair.md",
  "atlas_packet_path": ".project/atlas_outbox/20260702_coheronia_input_repair.json",
  "boh_packet_path": ".project/boh_outbox/20260702_coheronia_input_repair.json",
  "profiles": ["private_repo", "software_project"],
  "overrides": []
}
