{
  "schema_version": "0.2",
  "run_id": "20260702_coheronia_mvp_v01_oneshot",
  "project_id": "coheronia-game",
  "project_root": "B:/dev/Coheronia/coheronia_fable_oneshot_repo",
  "repo_root": "B:/dev/Coheronia/coheronia_fable_oneshot_repo",
  "branch": "main",
  "start_commit": "none-repo-initialized-this-run",
  "end_commit": "5ffcabf8701eb377c33b78ca8ff8e9ffd61680fe",
  "run_state": "SIGNABLE",
  "started_at": "2026-07-02T10:55:00-04:00",
  "ended_at": "2026-07-02T11:35:00-04:00",
  "summary": "Implemented the Coheronia v0.1 MVP vertical slice in Godot 4.6: seeded block terrain, hardness-timed mining, block/torch placement with dynamic light, Town Hall stockpile/deposit/repair, C/L/R computed from actual world state via data-driven formulas, day/night cycle, night slime threat event, torch crafting, F5/F9 save/load, full HUD, and a 22-check automated acceptance smoke test (all passing, headless and windowed with screenshot evidence).",
  "scope": "v0.1 MVP per docs/MVP_VERTICAL_SLICE.md only; no out-of-scope systems added.",
  "validation_state": "pass",
  "readme_state": "updated",
  "variable_matrix_state": "updated",
  "handoff_state": "updated",
  "boh_sync_state": "queued",
  "git_state": "committed",
  "risk_level": "low",
  "next_action": "Operator playthrough in Godot 4.6.1 for feel/tuning, then scope v0.2.",
  "ledger_path": ".project/runs/20260702_coheronia_mvp_v01_oneshot.md",
  "atlas_packet_path": ".project/atlas_outbox/20260702_coheronia_mvp_v01_oneshot.json",
  "boh_packet_path": ".project/boh_outbox/20260702_coheronia_mvp_v01_oneshot.json",
  "profiles": ["private_repo", "software_project"],
  "overrides": []
}
