{
  "schema_version": "0.2",
  "run_id": "20260714_coheronia_authored_sprite_coverage",
  "project_id": "coheronia-game",
  "project_root": "B:/dev/Coheronia/coheronia_fable_oneshot_repo",
  "repo_root": "B:/dev/Coheronia/coheronia_fable_oneshot_repo",
  "branch": "main",
  "start_commit": "1b19ad1",
  "end_commit": "1b19ad1",
  "run_state": "SIGNABLE",
  "started_at": "2026-07-14T12:45:00-04:00",
  "ended_at": "2026-07-14T15:07:21-04:00",
  "summary": "Post-FQ-15 authored-art run closes every current canonical block, inventory/live-drop, and live-enemy image gap and populates the live variety mechanisms. The repo now has 189 runtime PNGs: 71 blocks (20 canonicals; 17 three-entry pools), 43 canonical item/live-drop icons, 24 enemy sprites (six canonicals; six three-entry pools), 30 player sprites (ten canonicals; two alternate Looks each), and 21 unchanged structure/UI/background/wall assets. The run adds 117 net-new PNGs and replaces two human hue demos. Audit/runtime follow-through derives live enemy drops, limits Look choices to real pools, preserves opening frame semantics, restores generated player tones to exact rig palettes, and adds reusable normalizer/contact/verifier tooling. Strict audit is clean; pixel verifier passes 186 applicable PNGs; repo validator and capsule doctor pass; isolated Godot smoke passes 306/306 with every alternate Look recoloring; nine rendered tour frames and final contacts pass visual review. Generic player gear, final UI replacement art, and optional opening cels remain deliberately deferred. Changes are signable but uncommitted for operator review; no push performed.",
  "scope": "Current live sprite/image coverage and authored variation after FQ-15; no future enemy/system art, generic gear overlays, UI redesign, or opening-cel program.",
  "validation_state": "pass",
  "readme_state": "updated",
  "variable_matrix_state": "updated",
  "handoff_state": "updated",
  "boh_sync_state": "queued",
  "git_state": "scoped_dirty",
  "risk_level": "low",
  "next_action": "Operator reviews the final contacts/runtime capture and chooses whether to commit this signable pass or scope a body-specific player-gear alignment matrix.",
  "ledger_path": ".project/runs/20260714_coheronia_authored_sprite_coverage.md",
  "atlas_packet_path": ".project/atlas_outbox/20260714_coheronia_authored_sprite_coverage.json",
  "boh_packet_path": ".project/boh_outbox/20260714_coheronia_authored_sprite_coverage.json",
  "profiles": ["public_repo", "software_project"],
  "overrides": []
}
