{
  "schema_version": "0.2",
  "run_id": "example-install",
  "project_id": "example-private-repo",
  "project_root": ".",
  "repo_root": ".",
  "remote_url": "",
  "branch": "",
  "start_commit": "",
  "end_commit": "",
  "run_state": "SIGNABLE",
  "started_at": "2026-06-30T00:00:00-04:00",
  "ended_at": "2026-06-30T00:00:00-04:00",
  "summary": "Example capsule install event.",
  "scope": "Demonstrate minimal private repo install.",
  "validation_state": "not_checked",
  "readme_state": "audited_no_change",
  "variable_matrix_state": "no_change_verified",
  "handoff_state": "updated",
  "boh_sync_state": "queued",
  "git_state": "not_repo",
  "risk_level": "low",
  "next_action": "Use this as a reference for a real pilot.",
  "ledger_path": ".project/runs/example-install.md",
  "atlas_packet_path": ".project/atlas_outbox/example-install.json",
  "boh_packet_path": ".project/boh_outbox/example-install.json",
  "profiles": ["private_repo", "software_project"],
  "overrides": []
}

