{
  "schema_version": "0.2",
  "run_id": "20260709_coheronia_fq09s_skill_constellations",
  "project_id": "coheronia-game",
  "project_root": "B:/dev/Coheronia/coheronia_fable_oneshot_repo",
  "repo_root": "B:/dev/Coheronia/coheronia_fable_oneshot_repo",
  "branch": "main",
  "start_commit": "9daee86",
  "end_commit": "177d2ae",
  "run_state": "SIGNABLE",
  "started_at": "2026-07-09T15:20:00-04:00",
  "ended_at": "2026-07-09T16:05:00-04:00",
  "summary": "FQ-09S skill tree visual treatment: presentation-only star-map restyle of the FQ-06 panel. Night-sky backdrop with thin cool border; the node canvas draws a deterministic starfield (seed 20260709, 110 pixels), faint constellation links per prerequisite pair (bright when both ends owned, soft white toward available, near-invisible toward locked), and pixel star glyphs (4-arm crosshair; larger 8-arm star when owned); node buttons became dark plaques with state-colored borders/text instead of whole-button modulate. Perk data, point economy, prerequisites, save ownership, K/Esc behavior, the try_purchase_perk path, and the inspector text format are byte-identical — all fq06_* checks pass unchanged. New link_count() hook + fq09s_constellation_links_match_prereqs check (suite 184 -> 185). Review SIGNABLE with three nits, all applied; full loop re-ran green.",
  "scope": "FQ-09S only, per docs/FABLE_TASK_QUEUE.md — no new perks, effects, or progression economy. Implementation commit 177d2ae plus this evidence-only packet commit; not pushed (operator-gated).",
  "validation_state": "pass",
  "readme_state": "updated",
  "variable_matrix_state": "updated",
  "handoff_state": "updated",
  "boh_sync_state": "queued",
  "git_state": "committed",
  "risk_level": "low",
  "next_action": "FQ-09V: visual variant pipeline.",
  "ledger_path": ".project/runs/20260709_coheronia_fq09s_skill_constellations.md",
  "atlas_packet_path": ".project/atlas_outbox/20260709_coheronia_fq09s_skill_constellations.json",
  "boh_packet_path": ".project/boh_outbox/20260709_coheronia_fq09s_skill_constellations.json",
  "profiles": ["public_repo", "software_project"],
  "overrides": []
}
